{
  "from_name": "Ens, Amanda",
  "from_email": "[REDACTED]",
  "to": [
    {
      "to_name": "Jeffrey E.",
      "to_email": "jeevacation@gmail.com"
    },
    {
      "to_name": "Richard Kahn",
      "to_email": "[REDACTED]"
    }
  ],
  "sent": "2016-11-15T14:44:06Z",
  "subject": "SPX put contingent on higher rates",
  "importance": "HIGH",
  "attachments": [
    "image001.jpg",
    "image002.jpg",
    "image003.jpg",
    "image005.png"
  ],
  "body": [
    {
      "message_type": "message",
      "message_content": "Navigating post-Trump volatility\n• We are recording unprecedented divergences in falling equity vol with rising rates vol post Trump's win. Intra-day SPX realized vol moving sub 20% in 2d [Chart 1]\n• While equities have shown less conviction over what a Trump win means (given strong sector rotation), the bond market has sold off with one of the largest moves in history [Chart 2 & 3]\n• Stabilizing rates volatility from here is key to markets remaining calm and while equity upside may continue, it is not without higher risks\n• We like cheap optionality to hedge long-equities if rates continue to move sharply\n\nFor investors long equities, we look at ways to cheapen protecting from downside risks in the event of further bond market volatility or rethink our Trump policy uncertainty\n• Buy an SPX Apr-17 95% put conditional on US 10Y CMS > 2.5% at maturity for 0.87%\no 70% discount vs. vanilla\no CMS ref. 2.11%, SPX ref. 2,164.2\n\nCMS = constant maturity swap\n\n[IMAGE]Chart 1: The response in S&P 500 realized equity volatility to the US election surprise was similar to Brexit but more extreme, as the spike in volatility collapsed at record speed[/IMAGE]\n\n[IMAGE]Chart 2: Ten-year US Treasury yields see a near record spike after the US election[/IMAGE]\n\n[IMAGE]Chart 3: Long Bond futures prices down near record amount the US election (~5%) in the four days since the election[/IMAGE]\n\n[IMAGE]Additional charts showing largest 4-day % changes in 10yr UST yields since 1962 and 4-day return of a 30yr UST futures investment[/IMAGE]"
    }
  ]
}
