{
  "from_name": "Tonja Haddad Coleman",
  "from_email": "[REDACTED]",
  "to": [
    {
      "to_name": "Jeffrey Epstein",
      "to_email": "jeevacation@gmail.com"
    },
    {
      "to_name": "Darren Indyke",
      "to_email": "[REDACTED]"
    },
    {
      "to_name": "Debbie Fein",
      "to_email": "[REDACTED]"
    },
    {
      "to_name": "[REDACTED]",
      "to_email": "[REDACTED]"
    }
  ],
  "sent": "2013-05-13T22:28:30Z",
  "importance": "HIGH",
  "subject": "Farmer Jaffe is suing Donald Trump!",
  "attachments": [],
  "body": [
    {
      "message_type": "message",
      "message_content": "Farmer Jaffe is suing Donald Trump!\n\nhttp://www.mypalmbeachpost.com/news/business/lawsuit-lobbed-against-trumps-ownership-of-former-/nXjjQ/?icmp=pbp_internallink_inVitationbox_apr2013_pbpstubomypbp_launch\n\nTonja Haddad Coleman, Esq.\n**TONJA HADDAD, P.A.**\nAdvocate Building\n315 SE 7th Street\nFort Lauderdale, FL 33301\n[REDACTED]"
    }
  ]
}
