{
  "from_name": "Boris Nikolic",
  "from_email": "[REDACTED]",
  "to": [
    {
      "to_name": "Jeffrey Epstein",
      "to_email": "jeevacation@gmail.com"
    }
  ],
  "sent": "2012-03-23T19:10:58Z",
  "subject": "FW: World Bank Nominee",
  "importance": "HIGH",
  "attachments": [
    "image004.jpg",
    "image005.jpg"
  ],
  "body": [
    {
      "message_type": "message",
      "message_content": "The Atlantic Home\nFriday, March 23, 2012\n\n[IMAGE]Photo of Massoud Hayoun[/IMAGE]\n\nPolitics\nMassoud Hayoun - Massoud Hayoun writes for and produces The Atlantic's International channel.\n\nHow Jim Yong Kim, Obama's World Bank Pick, Changed Global Health Aid\n\nBy Massoud Hayoun\nMar 23 2012, 2:04 PM ET\nThe international public health work that made Kim, now the president's nominee for World Bank head, such a respected figure.\n\n[IMAGE]Photo of President Obama and Jim Yong Kim[/IMAGE]\n\nPresident Obama introduces Jim Yong Kim as his nominee to be the next president of the World Bank / Reuters\n\nPresident Obama announced today that he will nominate Dartmouth College President Jim Yong Kim to head the World Bank. Although Kim is a physician by training, officials have observed that Kim's role as a key player in global health and development, notably with his role in the organization Partners in Health (PIH), makes him a key candidate to change the attitudes of developing-world nations.\n\nThe following excerpts from Tracy Kidder's Mountains Beyond Mountains, a biography of anthropologist and global health luminary Paul Farmer, detail Kim's efforts to lead efforts to combat the epidemics ravaging developing nations.\n\nSome months after the official founding of PIH, [co-founder] Paul Farmer expanded the group, adding a fellow Harvard anthropology, and eventually to study medicine, named Jim Yong Kim. Farmer often offered high praise for Jim Kim was a convincing vision of the new organization. He really was less impressive - a chintzy with a head of advisers and no fixed staff.\n\n[Continues with extensive article text about Jim Yong Kim's work with Partners in Health, tuberculosis epidemic, AIDS treatment, and global health initiatives...]"
    }
  ]
}
